IDText,Text,Text_Merged,Translated_Text
TXT0533,prabowo adalah menhan terburuk sepanjang sejarah indonesia berdiri anggaran bertambah tapi jebol sama perahu kayu rohingya ini bukan karena pertahanan kita kurang canggih dan kuat melainkan karena menhan sibuk ngurusin singkong indonesia hanya menunggu kehancuran kalau dipimpin prabowo re paltiwest,prabowo adalah menhan terburuk sepanjang sejarah indonesia berdiri anggaran bertambah tapi jebol sama perahu kayu rohingya ini bukan karena pertahanan kita kurang canggih dan kuat melainkan karena menhan sibuk mengurusi singkong indonesia hanya menunggu kehancuran kalau dipimpin prabowo re paltiwest,"Prabowo is the worst defense minister in the history of Indonesia. The budget has increased but was destroyed by the Rohingya wooden boat. This is not because our defense is not sophisticated and strong enough, but because the defense minister is busy taking care of cassava. Indonesia is just waiting for destruction if Prabowo leads Re Paltiwest."
TXT0534,gw sih ga masalah pajak gw dan pajak banyak orang di luar sana di pake buat ngasih info ke umum biar gak banyak orang tersesat di buat data anies dan ganjar,gue sih enggak masalah pajak gue dan pajak banyak orang di luar sana di pakai buat mengasih info ke umum biar enggak banyak orang tersesat di buat data anies dan ganjar,I don't care about my taxes and the taxes of many people out there are used to provide information to the public so that not many people get lost in anies and reward data.
TXT0535,diberi nilai kecil oleh ganjar dan anies prabowo ungkap prestasinya selama jadi menhan re oposisicerdas,diberi nilai kecil oleh ganjar dan anies prabowo ungkap prestasinya selama jadi menhan re oposisicerdas,given low marks by ganjar and anies prabowo reveals his achievements during his time as minister of defense re ahli politikcerdas
TXT0536,tepat kata prabowo jangan menjadi pemimpin yang suka menghasut tidak beretika dan tukang omonomon,tepat kata prabowo jangan menjadi pemimpin yang suka menghasut tidak beretika dan tukang omonomon,"Prabowo is right, don't be a leader who likes to incite unethical behavior and is a bully"
TXT0537,ganjar vs prabowo di acara paku integritas kpk ganjar dlm memberantas korupsi menjaga independensi kpk transparansi anggaran miskinkan koruptor kirim ke nusakambangan prabowo naikkan gaji pejabat kasih kediaman resmi yg mewah silahkan dinilai ganjar presiden rakyat re chchotimah,ganjar vs prabowo di acara paku integritas kpk ganjar dalam memberantas korupsi menjaga independensi kpk transparansi anggaran miskinkan koruptor kirim ke nusakambangan prabowo naikkan gaji pejabat kasih kediaman resmi yang mewah silakan dinilai ganjar presiden rakyat re chchotimah,ganjar vs prabowo at the kpk integrity nail event ganjar in eradicating corruption maintaining the independence of the kpk budget transparency impoverish corruptors send to nusakambangan prabowo increase officials' salaries provide luxurious official residences please evaluate ganjar people's president re chchotimah
TXT0538,basi ngomong penculik saja yang muncul setiap pesta demokrasi pertanyaan kenapa ibu megawati mau menggandeng saat pesta demokrasi megawati prabowo,basi mengomong penculik saja yang muncul setiap pesta demokrasi pertanyaan kenapa ibu megawati mau menggandeng saat pesta demokrasi megawati prabowo,It's stale to talk about kidnappers only appearing at every democratic party. The question is why Mrs. Megawati wanted to hold hands with Megawati Prabowo during the democratic party.
TXT0539,smntara prabowo malah dgn bangga menguasai tanah hampir ribu hektar bahkan stelah dia bicara secara lugas mau ngatasi ketimpangan kemiskinan dan semua jargon kenegaraannya yang template slama kali debat dan kbengisan dilanjut oleh para buzzernya dg giring opini mcam ini,smntara prabowo malah dengan bangga menguasai tanah hampir ribu hektar bahkan setelah dia bicara secara lugas mau ngatasi ketimpangan kemiskinan dan semua jargon kenegaraannya yang template selama kali debat dan kbengisan dilanjut oleh para buzzernya dengan giring opini mcam ini,"Meanwhile, Prabowo is proud to control almost a thousand hectares of land, even after he spoke clearly about overcoming poverty inequality and all his state jargon that was a template during the debate and the cruelty continued by his buzzers by leading opinions like this."
TXT0540,ian wilson univ murdoch saya sama sekali tak melihat jokowi sebagai seorang demokrat manuver jokowi sbg bagian dari tren antidemokrasi yang dianut banyak politikus indonesia para politikus itu termasuk prabowo yang pernah berharap menggantikan ayah mertuanya soeharto re ccwithsybil,ian wilson universitas murdoch saya sama sekali tak melihat jokowi sebagai seorang demokrat manuver jokowi sebagai bagian dari tren antidemokrasi yang dianut banyak politikus indonesia para politikus itu termasuk prabowo yang pernah berharap menggantikan ayah mertuanya soeharto re ccwithsybil,ian wilson murdoch university i don't see jokowi as a democrat at all jokowi's maneuvers are part of an anti-democratic trend embraced by many indonesian politicians those politicians include prabowo who once hoped to replace his father-in-law soeharto re ccwithsybil
TXT0541,oleh septian  dengan nada meletupletup tangan memukulmukul udara prabowo subianto meluapkan kekesalannya karena bisnisbisnisnya mandek setelah dirinya tidak berkuasa momen di mata najwa itu jelas mengakhiri rasa penasaran publik kenapa dia betulbetul sangat bernafsu menggenggam kekuasaan ya ada dendam yang belum dituntaskannya di masa kekuasaan orde baru prabowo memang bagai anak emas karena mampu membangun banyak bisnis untuk mempertebal kekayaannya sampaisampai ratusan ribu hektar lahan negara dia kuasai namun setelah orde baru tumbang nepotisme perlahanlahan mulai disikat dan ini berdampak terhadap prabowo satusatunya agar bisa mengembalikan semua kejayaan itu adalah dengan meraih kekuasaan sudah pasti sesuatu yang diraih dengan ambisi menggebugebu akan dimanfaatkan betul jika sudah dalam genggaman begitupun kekuasaan bagi prabowo ia akan menggunakannya untuk memenuhi hasrat pribadi dan kelompoknya lain tidak kita bisa berkaca dari proyek food estate di kalteng baru menjabat menteri saja proyek triliunan itu menguap entah kemana ada hektar lahan singkong mangkrak dan sawah baru tak kunjung panen proyek itu dijalankan pt agrinas milik kementerian pertahanan orangorang kepercyaan prabowo di gerindra banyak menjabat pimpinan disana jajaran komisaris juga diisi para purnawirawan tni yang juga anggota tim kampanye prabowo pada cerita mungkin akan berbeda jika proyek pangan itu dipegang oleh ahlinya tentu saja dari perencanaan dan pelaksanaan akan lebih matang dan terukur kalau sudah pengedepankan nepotisme begini wajar publik curiga proyek itu hanya lahan untuk mengeruk duit rakyat itu baru food estate bayangkan jika prabowo berkuasa ada banyak sektor lain yang akan dikuasai dia dan kronikroninya sebut saja misalnya program makan siang dan bagibagi susu yang anggarannya mencapai rp triliun pertahun untuk susu perah saja produksi dalam negeri kita hanya sanggup memenuhi persen penduduk sisanya impor dari austalia dan selandia baru sudah pasti jika program tak masuk akal itu dipaksakan justru akan semakin menambah beban impor bisa ditebak yang diuntungkan selain peternak asing adalah importir yang sudah pasti akan diisi kronikroni prabowo disitu akan sangat rawan permainan dan celah korupsi karena beban anggaran itu sektorsektor belanja negara yang lain pun akan terdampak pantas saja prabowo sendiri di acara sarasehan ekonom menyebut anggaran program ini akan diambil dari dana pendidikan dan bansos artinya dana bos ataupun subsidi pendidikan akan dipangkas dan bantuan sosial yang selama ini dinikmati warga kurang mampu juga akan dipotong belum lagi wacana menaikkan pajak yang jelas akan membenani rakyat jika dipikirpikir situasinya betulbetul akan semakin kacau tatanan dan juga program yang selama ini dirasakan manfaatnya untuk rakyat akan dirusak hanya untuk program makan siang gratis yang sebenarnya cuma menguntungkan kronikroni prabowo re melihatindo,oleh septian dengan nada meletupletup tangan memukulmukul udara prabowo subianto meluapkan kekesalannya karena bisnisbisnisnya mandek setelah dirinya tidak berkuasa momen di mata najwa itu jelas mengakhiri rasa penasaran publik kenapa dia betulbetul sangat bernafsu menggenggam kekuasaan ya ada dendam yang belum dituntaskannya di masa kekuasaan orde baru prabowo memang bagai anak emas karena mampu membangun banyak bisnis untuk mempertebal kekayaannya sampaisampai ratusan ribu hektar lahan negara dia kuasai namun setelah orde baru tumbang nepotisme perlahanlahan mulai disikat dan ini berdampak terhadap prabowo satusatunya agar bisa mengembalikan semua kejayaan itu adalah dengan meraih kekuasaan sudah pasti sesuatu yang diraih dengan ambisi menggebugebu akan dimanfaatkan betul jika sudah dalam genggaman begitupun kekuasaan bagi prabowo ia akan menggunakannya untuk memenuhi hasrat pribadi dan kelompoknya lain tidak kita bisa berkaca dari proyek food estate di kalteng baru menjabat menteri saja proyek triliunan itu menguap entah kemana ada hektar lahan singkong mangkrak dan sawah baru tak kunjung panen proyek itu dijalankan pt agrinas milik kementerian pertahanan orangorang kepercyaan prabowo di gerindra banyak menjabat pimpinan disana jajaran komisaris juga diisi para purnawirawan tni yang juga anggota tim kampanye prabowo pada cerita mungkin akan berbeda jika proyek pangan itu dipegang oleh ahlinya tentu saja dari perencanaan dan pelaksanaan akan lebih matang dan terukur kalau sudah pengedepankan nepotisme begini wajar publik curiga proyek itu hanya lahan untuk mengeruk duit rakyat itu baru food estate bayangkan jika prabowo berkuasa ada banyak sektor lain yang akan dikuasai dia dan kronikroninya sebut saja misalnya program makan siang dan bagibagi susu yang anggarannya mencapai rp triliun pertahun untuk susu perah saja produksi dalam negeri kita hanya sanggup memenuhi persen penduduk sisanya impor dari austalia dan selandia baru sudah pasti jika program tak masuk akal itu dipaksakan justru akan semakin menambah beban impor bisa ditebak yang diuntungkan selain peternak asing adalah importir yang sudah pasti akan diisi kronikroni prabowo disitu akan sangat rawan permainan dan celah korupsi karena beban anggaran itu sektorsektor belanja negara yang lain pun akan terdampak pantas saja prabowo sendiri di acara sarasehan ekonom menyebut anggaran program ini akan diambil dari dana pendidikan dan bansos artinya dana bos ataupun subsidi pendidikan akan dipangkas dan bantuan sosial yang selama ini dinikmati warga kurang mampu juga akan dipotong belum lagi wacana menaikkan pajak yang jelas akan membenani rakyat jika dipikirpikir situasinya betulbetul akan semakin kacau tatanan dan juga program yang selama ini dirasakan manfaatnya untuk rakyat akan dirusak hanya untuk program makan siang gratis yang sebenarnya cuma menguntungkan kronikroni prabowo re melihatindo,"by septian with a bursting tone of hands hitting the air prabowo subianto vented his frustration because his businesses had stalled after he was no longer in power the moment in najwa's eyes clearly ended the public's curiosity as to why he was really so eager to grasp power yes there was a grudge that had not been resolved during the new order era prabowo was indeed like a golden child because he was able to build many businesses to thicken his wealth to the point that he controlled hundreds of thousands of hectares of state land but after the new order fell nepotism slowly began to be swept away and this had an impact on prabowo the only way to restore all that glory was to gain power it was certain that something that was achieved with great ambition would be utilized properly if it was already in his grasp likewise power for prabowo he would use it to fulfill his personal and group desires otherwise we can't look at the food estate project in central kalimantan when he had just become a minister the trillion project evaporated who knows where there were hectares of cassava land that was stalled and new rice fields that had not yet been harvested the project was run by pt agrinas owned by the ministry of defense people's trust in prabowo in Gerindra has many leadership positions there, the board of commissioners is also filled with retired TNI who are also members of Prabowo's campaign team. The story might be different if the food project was handled by experts. Of course, the planning and implementation would be more mature and measurable. If nepotism is prioritized like this, it is natural for the public to suspect that the project is just a place to take people's money. That's the food estate. Imagine if Prabowo were in power, there would be many other sectors that he and his cronies would control. For example, the lunch program and milk distribution with a budget of up to IDR trillion per year. For dairy milk alone, our domestic production is only able to meet 100% of the population. The rest is imported from Australia and New Zealand. It is certain that if this unreasonable program is forced, it will actually increase the import burden. It can be guessed that those who benefit apart from foreign farmers are importers who will definitely be filled with Prabowo's cronies. There will be a lot of corruption and corruption because of the budget burden. Other state spending sectors will also be affected. It is only natural that Prabowo himself at the economist's discussion event said that the budget for this program would be taken from education funds and social assistance, meaning BOS funds or Education subsidies will be cut and social assistance that has been enjoyed by the poor will also be cut, not to mention the discourse on increasing taxes which will clearly burden the people. If you think about it, the situation will really become more chaotic and the programs that have been felt to be beneficial for the people will be destroyed just for the free lunch program which actually only benefits Prabowo's cronies."
TXT0542,prabowo kalah di putaran pertama gue traktir orang pendukung siapapun makan di restoran abunawas re kursitribun,prabowo kalah di putaran pertama gue traktir orang pendukung siapapun makan di restoran abunawas re kursitribun,Prabowo lost in the first round. I treated everyone who supported him to a meal at the Abunawas Re Kursitribun restaurant
TXT0543,dari sini aja sudah keliatan sadisnya nyerang secara personal bilang gak punya potongan diktator ato otoriter sambil ngelirik prabowo dan nyerang mslh rekam jejak pelanggaran ham pdhl dia sendiri tidak mengusut pelanggaran ham itu selam tahun re bospurwa,dari sini saja sudah kelihatan sadisnya menyerang secara personal bilang enggak punya potongan diktator atau otoriter sambil ngelirik prabowo dan menyerang masalah rekam jejak pelanggaran ham padahal dia sendiri tidak mengusut pelanggaran ham itu selam tahun re bospurwa,"From here alone, it is clear how sadistic it is to personally attack someone by saying they don't have the chops to be dictatorial or authoritarian while glancing at Prabowo and attacking him on the issue of his track record of human rights violations, even though he himself has not investigated human rights violations during the years of Re Bospurwa."
TXT0544,bu kenapa masa jabatanya jadi mundur harusnya selesai tanggal desember jadi februari sebegininya ya demi kepentingan prabowogibran masyarakat mungkin pada tidak menggagas issu ini kan padahal penundaan masa jabatan melalui mk dan di kabulkan oleh mahkamah konstitusi ya allah lindungi bangsa ini dari orangorang yang serakah re gusraharjo,bu kenapa masa jabatanya jadi mundur harusnya selesai tanggal desember jadi februari sebegininya ya demi kepentingan prabowogibran masyarakat mungkin pada tidak menggagas issu ini kan padahal penundaan masa jabatan melalui maka dan di kabulkan oleh mahkamah konstitusi ya allah lindungi bangsa ini dari orangorang yang serakah re gusraharjo,"Ma'am, why was his term of office postponed? It should have ended in December but it was postponed to February like this. It's for the sake of Prabowo-Gibran. The public might not have initiated this issue, even though the postponement of the term of office was through the Constitutional Court and was granted by the Constitutional Court. Oh God, protect this nation from greedy people. Re Gusraharjo"
TXT0545,ganjar internet jangan dikorupsi wan angin langsung melet lidah langsung teringat menterinya om bewok yang ketangkap re kurawa,ganjar internet jangan dikorupsi wan angin langsung melet lidah langsung teringat menterinya om bewok yang ketangkap re kurawa,Ganjar internet don't corrupt wan angin immediately stuck out his tongue immediately remembering the minister om bewok who was caught by re kurawa
TXT0546,ganjarmahfud akan memastikan bahwa desadesa kita memiliki akses yang adil ke pelayanan publik happy new year,ganjarmahfud akan memastikan bahwa desadesa kita memiliki akses yang adil ke pelayanan publik happy new year,ganjarmahfud will ensure that our villages have fair access to public services happy new year
TXT0547,udah pernah di periksa sebanyak tiga kali bersih ngk ada korupsi sekarang malah ketua kpk nya yg di tangkap krna kasus pemerasan,sudah pernah di periksa sebanyak tiga kali bersih enggak ada korupsi sekarang malah ketua kpk nya yang di tangkap karena kasus pemerasan,"He has been questioned three times and is clean, there is no corruption, now the KPK chairman is the one who has been arrested for extortion"
TXT0548,program pasangan capres cawapres ganjar pranowo dan mahfud md dorong pertumbuhan ekonomi yang merata di setiap desa,program pasangan capres cawapres ganjar pranowo dan mahfud md dorong pertumbuhan ekonomi yang merata di setiap desa,The presidential and vice presidential candidate pair Ganjar Pranowo and Mahfud MD's program encourages equitable economic growth in every village
TXT0549,program pasangan capres cawapres ganjar pranowo dan mahfud md solusi jitu buat dorong pertumbuhan ekonomi desa,program pasangan capres cawapres ganjar pranowo dan mahfud md solusi jitu buat dorong pertumbuhan ekonomi desa,presidential and vice presidential candidate pair Ganjar Pranowo and Mahfud MD's program is a smart solution to encourage village economic growth
TXT0550,sumbar disebut tak lagi lumbung suara prabowo suara amin ditargetkan tembus re oposisicerdas,sumbar disebut tak lagi lumbung suara prabowo suara amin ditargetkan tembus re oposisicerdas,"West Sumatra is said to no longer be a vote bank for Prabowo, Amin's vote is targeted to penetrate the intelligent opposition"
TXT0551,luas jogja rb hektar luas jakarta rb hektar luas singapura rb hektar,luas jogja ribu hektar luas jakarta ribu hektar luas singapura ribu hektar,area of ​​jogja thousand hectares area of ​​jakarta thousand hectares area of ​​singapore thousand hectares
TXT0552,makan malam jokowiprabowo merusak psikologis pendukung anies dan ganjar re oposisicerdas,makan malam jokowiprabowo merusak psikologis pendukung anies dan ganjar re oposisicerdas,jokowiprabowo dinner damages the psychology of anies and ganjar re supporters smart opposition
TXT0553,anies terlihat arogan pada sesi debat ini prabowo fokus pada utang dia tdk pernah menyinggung ttg korupsi ganjar mulai keliatan dewasa pada sesi ini re dodonalone,anies terlihat arogan pada sesi debat ini prabowo fokus pada utang dia tidak pernah menyinggung tentang korupsi ganjar mulai kelihatan dewasa pada sesi ini re dodonalone,"Anies looks arrogant in this debate session Prabowo focuses on debt, he never mentions corruption Ganjar starts to look mature in this session re dodonalone"
TXT0554,orang munafik yg sok idealis skrg dia udah buka topeng aslinyamana tau dpt kursi menteri itupun kalau prabowo menang tapi sorry yeeee rakyat gk suka prabowo skrg,orang munafik yang sok idealis sekarang dia sudah buka topeng aslinyamana tau dapat kursi menteri itupun kalau prabowo menang tapi sorry ya rakyat enggak suka prabowo sekarang,"a hypocrite who pretends to be an idealist, now he has taken off his real mask, who knows, he might get a ministerial seat, even if Prabowo wins, but sorry, the people don't like Prabowo now"
TXT0555,faizalassegaf debat capres ganjar dan masih belum merespon aspirasi kelompok oposisi yang menuntut lengserkan serta kekhawatiran soal pilpres yang terancam curang ganjar mahfud hebat,faizalassegaf debat capres ganjar dan masih belum merespon aspirasi kelompok oposisi yang menuntut lengserkan serta kekhawatiran soal pilpres yang terancam curang ganjar mahfud hebat,faizalassegaf presidential candidate debate ganjar and still has not responded to the aspirations of the opposition group demanding his removal and concerns about the presidential election being threatened with fraud ganjar mahfud hebat
TXT0556,nahh itu dia laeku ga bisa dibuka semua data itu pernah prabowo waktu di senayan lawan anggota dpr ri ga bakalan mau rapat terbuka utk bahas anggaran krn memang rahasia negara ada beritanya itu,nah itu dia laeku enggak bisa dibuka semua data itu pernah prabowo waktu di senayan lawan anggota dpr ri enggak bakalan mau rapat terbuka untuk bahas anggaran karena memang rahasia negara ada beritanya itu,"Well, that's it, I can't open all the data. Prabowo once said that when he was in Senayan, his opponent was a member of the Indonesian House of Representatives, he wouldn't want to have an open meeting to discuss the budget because it was a state secret, there was news about it."
TXT0557,teknologi militer terus berkembang mari kita investasikan dalam pertahanan untuk masa depan yang aman garagara prabowo,teknologi militer terus berkembang mari kita investasikan dalam pertahanan untuk masa depan yang aman garagara prabowo,military technology continues to develop let's invest in defense for a safe future because of prabowo
TXT0558,ganjar mahfud taat pada hukum dan konstitusi ganjar mahfud adalah peluru yg tak terkendali dalam pemberantasan korupsi di indonesia,ganjar mahfud taat pada hukum dan konstitusi ganjar mahfud adalah peluru yang tak terkendali dalam pemberantasan korupsi di indonesia,Ganjar Mahfud obeys the law and the constitution Ganjar Mahfud is an uncontrolled bullet in the eradication of corruption in Indonesia
TXT0559,kebersamaan ganjar pranowo dengan srimulat adalah pelajaran bahwa politik bisa dijalani dengan sikap santai dan penuh tawa ganjar mahfud hebat uang saku posyandu,kebersamaan ganjar pranowo dengan srimulat adalah pelajaran bahwa politik bisa dijalani dengan sikap santai dan penuh tawa ganjar mahfud hebat uang saku posyandu,Ganjar Pranowo's togetherness with Srimulat is a lesson that politics can be lived with a relaxed attitude and full of laughter Ganjar Mahfud is great at posyandu pocket money
