IDText,Text,Text_Merged,Translated_Text
TXT0753, video tersebut terdapat potongan video ketika ganjar pranowo menyebut jika lebih memilih mendukungnya ganjar mahfud hebat,video tersebut terdapat potongan video ketika ganjar pranowo menyebut jika lebih memilih mendukungnya ganjar mahfud hebat,"The video contains a video clip of Ganjar Pranowo saying that if he chose to support Ganjar Mahfud, he would be great."
TXT0754,pak anies baswedan salah menyampaikan data pak prabowo meluruskan jangan sampai capres menyebarkan hoaks,pak anies baswedan salah menyampaikan data pak prabowo meluruskan jangan sampai capres menyebarkan hoaks,Mr. Anies Baswedan conveyed the wrong data. Mr. Prabowo corrected it. Don't let the presidential candidate spread hoaxes.
TXT0755,pangan energi dan air merupakan pilar utama bagi kemandirian dan kedaulatan suatu negara indonesia dengan kekayaan alam yang melimpah memiliki potensi besar untuk mencapai kemandirian maka dari itu penting untuk memliki strategi pengelolaan sda yang tepat agar dapat memberikan manfaat maksimal bagi masyarakat dan mendorong negara ini menuju kemandirian re prabowo,pangan energi dan air merupakan pilar utama bagi kemandirian dan kedaulatan suatu negara indonesia dengan kekayaan alam yang melimpah memiliki potensi besar untuk mencapai kemandirian maka dari itu penting untuk memliki strategi pengelolaan sda yang tepat agar dapat memberikan manfaat maksimal bagi masyarakat dan mendorong negara ini menuju kemandirian re prabowo,"Food, energy and water are the main pillars for the independence and sovereignty of a country. Indonesia, with its abundant natural resources, has great potential to achieve independence. Therefore, it is important to have the right natural resource management strategy in order to provide maximum benefits to the community and encourage this country towards independence. Re Prabowo"
TXT0756,unhcr tu khusus pengungsi bukan lembaga amil zakat indonesia atau pemerintah atau prabowo apalagi tapi dari donatur luar negeripbb heran dah goblok bner,unhcr itu khusus pengungsi bukan lembaga amil zakat indonesia atau pemerintah atau prabowo apalagi tapi dari donatur luar negeripbb heran deh goblok benar,"UNHCR is specifically for refugees, not an Indonesian zakat collection institution or the government or Prabowo, let alone from foreign donors. The UN is really surprised, they are really stupid."
TXT0757,hanya kecurangan yg bisa mengalahkan ganjarmahfud dan kalaupun kalian memenangkan kecurangan maka kami tidak akan tinggal diam kami akan melawan sampe titik darah penghabisan krn perlawanan bukan hanya utk ganjarmahfud tapi perlawanan demi masa depan demokrasi ibu pertiwi re kakekhalal,hanya kecurangan yang bisa mengalahkan ganjarmahfud dan kalaupun kalian memenangkan kecurangan maka kami tidak akan tinggal diam kami akan melawan sampai titik darah penghabisan karena perlawanan bukan hanya untuk ganjarmahfud tapi perlawanan demi masa depan demokrasi ibu pertiwi re kakekhalal,only cheating can defeat ganjarmahfud and even if you win cheating then we will not remain silent we will fight to the last drop of blood because resistance is not only for ganjarmahfud but resistance for the future of democracy motherland re nenekhalal
TXT0758,ganjar pranowo sosok yang berdedikasi tinggi untuk menciptakan pemerintahan yang efisien dan responsif,ganjar pranowo sosok yang berdedikasi tinggi untuk menciptakan pemerintahan yang efisien dan responsif,Ganjar Pranowo is a figure who is highly dedicated to creating an efficient and responsive government.
TXT0759,kalo kata anies jika yang kecil melanggar biasanya karena kebutuhan maka penuhi kebutuhannya maka pelanggaran akan hilang tapi apabila yang besar melanggar biasanya karena keserakahan maka orang spt ini harus dihukum karena keserakahannya bukan malah disejahterakan re afdhalm,kalo kata anies jika yang kecil melanggar biasanya karena kebutuhan maka penuhi kebutuhannya maka pelanggaran akan hilang tapi apabila yang besar melanggar biasanya karena keserakahan maka orang seperti ini harus dihukum karena keserakahannya bukan malah disejahterakan re afdhalm,"According to Anies, if a small person violates the law, it is usually because of need, so fulfill their needs and the violation will disappear, but if a big person violates it, it is usually because of greed, so people like this must be punished for their greed, not made prosperous re afdhalm"
TXT0760,ganjar hadir untuk mewujudkan kesejahteraan prajurit,ganjar hadir untuk mewujudkan kesejahteraan prajurit,Ganjar is here to realize the welfare of soldiers
TXT0761,pledoinya bang hariz sebagai bukti kemunduran demokrasi dan kebebasan berpendapat anies bubble re radityahartono,pledoinya bang hariz sebagai bukti kemunduran demokrasi dan kebebasan berpendapat anies bubble re radityahartono,Bang Hariz's plea as evidence of the decline of democracy and freedom of speech Anies Bubble re Radityahartono
TXT0762,dukungan untuk paslon ganjarmahfud terus mengalir kali ini datang dari istri almarhum didi kempot yan vellia dia menilai dan ini adalah pasangan pemimpin yang epat untuk membawa indonesia lebih unggul khususnya rekam jejak ganjar pranowo yang memiliki keseriusan mengentaskan angka kemiskinan membuat yan vellia mempercayakan ganjar untuk memimpin organisasi yang lebih luas cakupannya sebesar negara re melihatindo,dukungan untuk paslon ganjarmahfud terus mengalir kali ini datang dari istri almarhum didi kempot yan vellia dia menilai dan ini adalah pasangan pemimpin yang epat untuk membawa indonesia lebih unggul khususnya rekam jejak ganjar pranowo yang memiliki keseriusan mengentaskan angka kemiskinan membuat yan vellia mempercayakan ganjar untuk memimpin organisasi yang lebih luas cakupannya sebesar negara re melihatindo,"Support for the Ganjar Mahfud candidate pair continues to flow, this time coming from the wife of the late Didi Kempot, Yan Vellia. She assessed that this is the right pair of leaders to bring Indonesia to greater heights, especially Ganjar Pranowo's track record of being serious about eradicating poverty, making Yan Vellia entrust Ganjar to lead an organization with a wider scope as large as the country."
TXT0763,hasto pak prabowo tidak bisa blusukan re oposisicerdas,hasto pak prabowo tidak bisa blusukan re oposisicerdas,Hasto Mr Prabowo can't go on field visits to the opposition smart
TXT0764,goganjargo ganjar optimis capai pertumbuhan ekonomi sahabatganjar ganjar menangkanganjar generasigotongroyong ganjar mahfud hebat nelayansejahtera,goganjargo ganjar optimis capai pertumbuhan ekonomi sahabatganjar ganjar menangkanganjar generasigotongroyong ganjar mahfud hebat nelayansejahtera,goganjargo ganjar optimistic to achieve economic growth friendsganjar ganjar winsganjar generationgotong royong ganjar mahfud great fishermen prosperous
TXT0765,partisipasi aktif warga negara adalah tonggak demokrasi yang sehat prabowo gibran mendorong keterlibatan semua,partisipasi aktif warga negara adalah tonggak demokrasi yang sehat prabowo gibran mendorong keterlibatan semua,active citizen participation is the cornerstone of a healthy democracy prabowo gibran encourages the involvement of all
TXT0766,top statement dari top gan closing statement ganjar sangat rasional untuk direalisasikan mulai dari komitmennya soal menguatkan pertahanan cyber meningkatkan anggaran sampai dari pdb mendorong profesionalisme aparat kesejahteraan prajurit dan keluarga sampau beasiswa kuliah anak prajuritbhayangkara indonesia garda sumudra we are growth re anakogi,top statement dari top gan closing statement ganjar sangat rasional untuk direalisasikan mulai dari komitmennya soal menguatkan pertahanan cyber meningkatkan anggaran sampai dari pdb mendorong profesionalisme aparat kesejahteraan prajurit dan keluarga sampau beasiswa kuliah anak prajuritbhayangkara indonesia garda sumudra we are growth re anakogi,"top statement from top gan Ganjar's closing statement is very rational to be realized starting from his commitment to strengthening cyber defense, increasing the budget to GDP, encouraging professionalism of the apparatus, welfare of soldiers and their families, to scholarships for the children of soldiers of the Indonesian Bhayangkara, Garda Sumudra, we are growth, re anakogi"
TXT0767,kesejahteraan indonesia di masa mendatang pilih ganjar pranowo dan mahfud md pilihanumat jnk temanganjar kampanye pilpres atikohibunegara ganjar mahfud hebat internet gratis,kesejahteraan indonesia di masa mendatang pilih ganjar pranowo dan mahfud md pilihanumat jnk temanganjar kampanye pilpres atikohibunegara ganjar mahfud hebat internet gratis,"Indonesia's prosperity in the future, elect Ganjar Pranowo and Mahfud MD, elect the people, JNK Temanganjar, Atikohibunegara presidential election campaign, Ganjar Mahfud Besar, free internet"
TXT0768,habis debat soal pesawat bekas prabowo teken kontrak msn re kasims,habis debat soal pesawat bekas prabowo teken kontrak msn re kasims,"After the debate about the used plane, Prabowo signed the MSN RE Kasims contract"
TXT0769,anies rocked anggaran berlimpah tapi kementrian pertahanan malah kena hack tentara tidak pernah rumah tapi menterinya punya lahan ratusan ribu hektar ironi re andika,anies rocked anggaran berlimpah tapi kementrian pertahanan malah kena hack tentara tidak pernah rumah tapi menterinya punya lahan ratusan ribu hektar ironi re andika,"Anies rocked the abundant budget but the Ministry of Defense was hacked, the army never had a house but the minister had hundreds of thousands of hectares of land, the irony is Andika"
TXT0770,di bekasi anies emang kerjanya kgk beres tahun jadi gubernur jakarta kgk ada hasilnya buat bekasi cih re txtdrbekasi,di bekasi anies memang kerjanya kgk beres tahun jadi gubernur jakarta kgk ada hasilnya buat bekasi cih re txtdrbekasi,"in bekasi anies his work is indeed not finished, the year he became governor of jakarta there were no results for bekasi cih re txtdrbekasi"
TXT0771,ganjar optimis capai pertumbuhan ekonomi sahabatganjar ganjar menangkanganjar generasigotongroyong ganjar mahfud hebat perempuan maju,ganjar optimis capai pertumbuhan ekonomi sahabatganjar ganjar menangkanganjar generasigotongroyong ganjar mahfud hebat perempuan maju,"ganjar optimistic to achieve economic growth, friends, ganjar wins, ganjar generation, mutual cooperation, ganjar mahfud, great, women are advanced"
TXT0772,ganjarmahfud akan membangun fondasi yang kokoh untuk pertumbuhan ekonomi happy new year,ganjarmahfud akan membangun fondasi yang kokoh untuk pertumbuhan ekonomi happy new year,ganjarmahfud will build a solid foundation for economic growth happy new year
TXT0773,dalam momentum pilpres mencoblos ganjar pranowo adalah langkah menuju pemerintahan yang efektif dan efisien,dalam momentum pilpres mencoblos ganjar pranowo adalah langkah menuju pemerintahan yang efektif dan efisien,"In the momentum of the presidential election, voting for Ganjar Pranowo is a step towards effective and efficient governance."
TXT0774,sebut perlu internet cepat buat dukung keamanan siber calon presiden atau capres nomor urut tiga ganjar pranowo menyebutkan kebutuhan internet cepat terkait masalah keamanan siber menurut ganjar untuk masalah keamanan siber dibutuhkan perkuatan badan siber dan sandi negara bssn serta penting untuk membuat sistem keamanan yang baik bahkan selain membangun sdm dan infrastruktur yang baik maka kecepatan internet dan coveragenya harus tinggi maka kalau kita kemudian membuat satu sistem infrastruktur yang bagus jangan dikorupsi kata ganjar top gan,sebut perlu internet cepat buat dukung keamanan siber calon presiden atau capres nomor urut tiga ganjar pranowo menyebutkan kebutuhan internet cepat terkait masalah keamanan siber menurut ganjar untuk masalah keamanan siber dibutuhkan perkuatan badan siber dan sandi negara bssn serta penting untuk membuat sistem keamanan yang baik bahkan selain membangun sdm dan infrastruktur yang baik maka kecepatan internet dan coveragenya harus tinggi maka kalau kita kemudian membuat satu sistem infrastruktur yang bagus jangan dikorupsi kata ganjar top gan,mention the need for fast internet to support cyber security presidential candidate or presidential candidate number three ganjar pranowo said the need for fast internet is related to cyber security issues according to ganjar for cyber security issues it is necessary to strengthen the national cyber and code agency bssn and it is important to create a good security system even besides building good human resources and infrastructure then the internet speed and coverage must be high so if we then create a good infrastructure system don't corrupt it said ganjar top gan
TXT0775,lu tau food estate ga kalo prabowo memberikan dukungan maksimal ke petani ngpain bkin food estate dananya ya kasihkan ke petani aja misal subsidi pupukbibit hasilnya di beli dijual murah ke rakyat,lu tau food estate enggak kalo prabowo memberikan dukungan maksimal ke petani ngpain bikin food estate dananya ya kasihkan ke petani saja misal subsidi pupukbibit hasilnya di beli dijual murah ke rakyat,"Do you know about food estates? If Prabowo gives maximum support to farmers, why create a food estate? Just give the funds to farmers, for example, fertilizer subsidies, buy seeds and sell them cheaply to the people."
TXT0776,dlfgjeumojzapzyzogvmacswzdmguwdm branding prabowo ikut pilpres  kuat sih di grassroot aniesganjar mungkin populer di kalangan masyarakat menengah atas yg bisa twiterantiktokan cm di kampung dan pelosok jgnkan internet sinyal edge aja susah elektabilitas prabowo bisa jadi tinggi,dlfgjeumojzapzyzogvmacswzdmguwdm branding prabowo ikut pilpres kuat sih di grassroot aniesganjar mungkin populer di kalangan masyarakat menengah atas yang bisa twiterantiktokan cuma di kampung dan pelosok jgnkan internet sinyal edge saja susah elektabilitas prabowo bisa jadi tinggi,"dlfgjeumojzapzyzogvmacswzdmguwdm Prabowo's branding to take part in the presidential election is strong in the grassroot. Aniesganjar may be popular among the upper middle class who can only use Twitter in villages and remote areas, don't even have edge signal internet, it's difficult. Prabowo's electability could be high"
TXT0777,bedakan mngoreksi dg gaslight atau denial misal faktanya anies mengucapkan selamat natal tiap thn malah aneh kalau netizens disuruh diam sj ketika dia mmberi kesan anies ga mau ngucapin ini ke pemakaian diksi provokatif dg mngatakan gerbong agama radikal sgt wajar dikoreksi re imaisback,bedakan mngoreksi dengan gaslight atau denial misal faktanya anies mengucapkan selamat natal tiap tahun malah aneh kalau netizens disuruh diam saja ketika dia memberi kesan anies enggak mau mengucapkan ini ke pemakaian dikasih provokatif dengan mngatakan gerbong agama radikal sangat wajar dikoreksi re imaisback,"distinguish correcting with gaslighting or denial, for example, the fact is that Anies says Merry Christmas every year, it would be strange if netizens were told to keep quiet when he gave the impression that Anies didn't want to say this to the user, given provocative comments by saying that the radical religious group is very reasonable to correct re imaisback"
TXT0778,keberlanjutan program kesehatan ibu dan anak menjadi prioritas ganjar pranowo prof mahfud menjamin kesejahteraan keluarga sebagai fondasi pembangunanjnke,keberlanjutan program kesehatan ibu dan anak menjadi prioritas ganjar pranowo prof mahfud menjamin kesejahteraan keluarga sebagai fondasi pembangunanjnke,"The sustainability of maternal and child health programs is a priority for Ganjar Pranowo, Prof. Mahfud, to ensure family welfare as the foundation for development."
TXT0779,anies pemberantasan korupsi dimulai dari presiden re tvonenews,anies pemberantasan korupsi dimulai dari presiden re tvonenews,anies corruption eradication starts from president re tvonenews
TXT0780,aksi nyata pasangan capres cawapres ganjar pranowo mahfud md perjuangkan kredit untuk koprasi dan umkm mari bersama sukseskan bisnis lokal nct wish,aksi nyata pasangan capres cawapres ganjar pranowo mahfud md perjuangkan kredit untuk koprasi dan umkm mari bersama sukseskan bisnis lokal nct wish,real action of presidential and vice presidential candidate pair ganjar pranowo mahfud md fighting for credit for cooperatives and UMKM let's work together to make local businesses a success nct wish
TXT0781,debat ngomongin demokrasi tapi nyatanya ko begini pak ganjar pranowo ubanbukanpakde ganjar mahfud hebat lulus pasti kerja,debat mengomongkan demokrasi tapi nyatanya kok begini pak ganjar pranowo ubanbukanpakde ganjar mahfud hebat lulus pasti kerja,"the debate talks about democracy but in reality it's like this, Mr Ganjar Pranowo is gray-haired, not Mr Ganjar Mahfud, great, graduates will definitely get a job"
TXT0782,diantara semua calon yg bertanding cm prabowo yg pernah berurusan dg kasus pelanggaran ham berat re lamsijan,diantara semua calon yang bertanding cuma prabowo yang pernah berurusan dengan kasus pelanggaran ham berat re lamsijan,"Among all the candidates competing, only Prabowo has ever had to deal with the serious human rights violation case of Re Lamsijan"
TXT0783,slogan baru anies indonesia absence no more respected forever indonesia absence no more respected forever kata anies memungkasi pernyataan penutupnya sembari menyilangkan tangan di dada ini via,slogan baru anies indonesia absence no more respected forever indonesia absence no more respected forever kata anies memungkasi pernyataan penutupnya sembari menyilangkan tangan di dada ini via,anies' new slogan indonesia absence no more respected forever indonesia absence no more respected forever said anies concluding his closing statement while crossing his arms across his chest this via
TXT0784,pasangan duet capres cawapres ganjar pranowo dan prof mahfud md lagi fokus bikin regulasi hukum yang gak bikin investor mikir dua kali untuk masuk indonesiajna,pasangan duet capres cawapres ganjar pranowo dan prof mahfud md lagi fokus bikin regulasi hukum yang enggak bikin investor mikir dua kali untuk masuk indonesiajna,"The presidential duet pair, Vice President, Ganjar Pranowo and Prof. Mahfud MD are currently focused on making legal regulations that don't make investors think twice about entering Indonesia."
TXT0785,tapi bener kok kata anies dan cerita pengalaman ketika menjabat kenapa tidak menceritakan pengalaman dia sebagai menhan malah selalu blg saya akan saya akan re rsoewarianto,tapi benar kok kata anies dan cerita pengalaman ketika menjabat kenapa tidak menceritakan pengalaman dia sebagai menhan malah selalu bilang saya akan saya akan re rsoewarianto,"but it's true what Anies said and the story of his experiences when he was in office, why didn't he tell about his experiences as Minister of Defense, instead he always said I will, I will re rsoewarianto"
TXT0786,secara moral prabowo sudah tak pantss bicara di depan rakyat program food industri yg hanya sisanya tanah gundul singkongnya tak ada gagal,secara moral prabowo sudah tak pantss bicara di depan rakyat program food industri yang hanya sisanya tanah gundul singkongnya tak ada gagal,"Morally Prabowo is no longer in his pants to speak in front of the people. The food industry program, which only has bare cassava left, has failed."
TXT0787,calon pejabat publik hrs siap dikuliti kelemahannya shg pejabat publik terpilih bnr bs jd tauladan  debat lg moga klo ada caprescawapres yg punya rekam jejak menyimpang dari hukum konstitusi amp etika dpt diungkap dlm debat cth sring nenggak miras dugem selingkuh dll,calon pejabat publik harus siap dikuliti kelemahannya shg pejabat publik terpilih benar bisa jadi tauladan debat lagi moga kalo ada caprescawapres yang punya rekam jejak menyimpang dari hukum konstitusi amp etika dapat diungkap dalam debat cth sring nenggak miras dugem selingkuh dll,"Candidates for public office must be ready to have their weaknesses exposed so that the elected public officials can truly be role models for the debate. Hopefully, if there are presidential and vice presidential candidates who have a track record of deviating from constitutional law and ethics, this can be revealed in the debate, for example, often drinking alcohol, going clubbing, having affairs, etc."
TXT0788,sumitro mengakui sifat prabowo yang arogan dan temperamental sumitro pun mengakui bahwa prabowo menculik aktivis pro demokrasi pada masamasa sebelum reformasi,sumitro mengakui sifat prabowo yang arogan dan temperamental sumitro pun mengakui bahwa prabowo menculik aktivis pro demokrasi pada masamasa sebelum reformasi,Sumitro acknowledged that Prabowo was arrogant and temperamental. Sumitro also acknowledged that Prabowo kidnapped pro-democracy activists during the pre-reform era.
TXT0789,mendukung abis kerja yang masbowogbran pastinya selalu kerjain itu seperti investasi utk nusantara benefitnya yaitu negeri ini jadi sejahtera karenahati baikpakbowo,mendukung habis kerja yang masbowogbran pastinya selalu kerjain itu seperti investasi untuk nusantara benefitnya yaitu negeri ini jadi sejahtera karenahati baikpakbowo,"supporting the work that Masbowo always does is like investing in the archipelago, the benefit is that this country will be prosperous because of Pakbowo's good heart"
TXT0790,sebelum debatprabowo sudah menguasai materi nyaapalgi mdaalah pertahanan itu hbitat nya diasesudah debatprabowo dikeroyokdgn cra iniblah itu lahelo kirain cpres lain bodoh apa yg disampikan paslon lain itu sebahagian aspirasi rakyataplgi msaalh etika,sebelum debatprabowo sudah menguasai materi nyaapalgi mdaalah pertahanan itu hbitat nya diasesudah debatprabowo dikeroyokdgn cra iniblah itu lahelo mengira cpres lain bodoh apa yang disampikan paslon lain itu sebahagian aspirasi rakyataplgi msaalh etika,"Before the debate, Prabowo had already mastered the material, especially the defense issue, his habitat. After the debate, Prabowo was attacked in this way. You think the other presidential candidates are stupid. What the other candidates said was part of the people's aspirations, especially the ethical issues."
TXT0791,ganjar mahfud hebat aanisfauzana prabowoa aniesbaswedan  bersih kuatkankpk sikatkorupsi hebata tauhid,ganjar mahfud hebat aanisfauzana prabowoa aniesbaswedan bersih kuatkankpk sikatkorupsi hebata tauhid,ganjar mahfud great aanisfauzana prabowoa aniesbaswedan clean strengthenkpk cleancorruption great tauhid
