IDText,Text,Text_Merged,Translated_Text
TXT0265,bonus demografi akan menjadi potensi besar yang dimanfaatkan untuk memacu pertumbuhan ekonomi dan ganjarmahfud memiliki visi jelas untuk mewujudkannya happy new year,bonus demografi akan menjadi potensi besar yang dimanfaatkan untuk memacu pertumbuhan ekonomi dan ganjarmahfud memiliki visi jelas untuk mewujudkannya happy new year,demographic bonus will be a great potential that can be utilized to spur economic growth and ganjarmahfud has a clear vision to make it happen happy new year
TXT0266,saya dulu berpikir polarisasi akan berkurang kalau jokowi menggandeng prabowo dalam koalisi ternyata setelah jokowi dan prabowo bergabung dalam pilpres yang terjadi malah lebih parah dari pilpres sebelumnya jangan siasiakan nyawa yang melayang dan darah yang tertumpah selamatkan demokrasi kita dari prabowo gibran re paltiwest,saya dulu berpikir polarisasi akan berkurang kalau jokowi menggandeng prabowo dalam koalisi ternyata setelah jokowi dan prabowo bergabung dalam pilpres yang terjadi malah lebih parah dari pilpres sebelumnya jangan siasiakan nyawa yang melayang dan darah yang tertumpah selamatkan demokrasi kita dari prabowo gibran re paltiwest,"I used to think that polarization would decrease if Jokowi joined Prabowo in a coalition. It turned out that after Jokowi and Prabowo joined the presidential election, what happened was even worse than the previous presidential election. Don't waste the lives that were lost and the blood that was spilled. Save our democracy from Prabowo. Gibran Re Paltiwest"
TXT0267,dukung ganjar dan mahfud agar indonesia bisa bersatu dalam pertumbuhan ekonomi happy new year,dukung ganjar dan mahfud agar indonesia bisa bersatu dalam pertumbuhan ekonomi happy new year,support ganjar and mahfud so that indonesia can unite in economic growth happy new year
TXT0268,penurunan paksa iklan videotron anies baswedan timnas amin berencana mengambil langkah hukum re oposisicerdas,penurunan paksa iklan videotron anies baswedan timnas amin berencana mengambil langkah hukum re oposisicerdas,forced removal of videotron advertisements anies baswedan national team amin plans to take legal steps re politikcerdas
TXT0269,iya buat timses pak anies makasih ya udh kasih kami ruang untuk berdemokrasi sesuai dgn apa yg kami senangi,iya buat timses pak anies terima kasih ya sudah kasih kami ruang untuk berdemokrasi sesuai dengan apa yang kami senangi,"Yes, to Mr. Anies' campaign team, thank you for giving us space to practice democracy according to what we like."
TXT0270,prabowo pembohong besar tidak layak jadi calon presiden kamera menunjukkan prabowo pergi ketika mau didatangi anies,prabowo pembohong besar tidak layak jadi calon presiden kamera menunjukkan prabowo pergi ketika mau didatangi anies,Prabowo is a big liar and is not worthy of being a presidential candidate. The camera shows Prabowo leaving when Anies wanted to visit him.
TXT0271,mk kpu dpr menteri bawaslu asn apdesi lembaga survei polri tni dear president apakah kami yang bukan pendukung dan masih rakyat anda inikah wajah demokrasi riang gembira yang sesungguhnya re nichnach,maka kpu dpr menteri bawaslu asn apdesi lembaga survei polri tni dear president apakah kami yang bukan pendukung dan masih rakyat anda inikah wajah demokrasi riang gembira yang sesungguhnya re nichnach,"then kpu dpr ministers bawaslu asn apdesi survey institute polri tni dear president, are we who are not your supporters and are still your people, is this the true face of cheerful democracy? re nichnach"
TXT0272,program pasangan capres cawapres ganjar pranowo dan mahfud md solusi jitu buat dorong pertumbuhan ekonomi desa,program pasangan capres cawapres ganjar pranowo dan mahfud md solusi jitu buat dorong pertumbuhan ekonomi desa,presidential and vice presidential candidate pair Ganjar Pranowo and Mahfud MD's program is a smart solution to encourage village economic growth
TXT0273,debat capres pertama ganjar tegaskan jaga demokrasi dan sikat korupsi bengis ganjar mahfud hebat,debat capres pertama ganjar tegaskan jaga demokrasi dan sikat korupsi bengis ganjar mahfud hebat,First presidential debate Ganjar emphasizes maintaining democracy and eradicating cruel corruption Ganjar Mahfud is great
TXT0274,ganjarmahfud memiliki komitmen kuat untuk memastikan adanya investasi di desa happy new year,ganjarmahfud memiliki komitmen kuat untuk memastikan adanya investasi di desa happy new year,ganjarmahfud has a strong commitment to ensure investment in the happy new year village
TXT0275,tanah yg disinggung sianies semalam rupanya pnh digadaikan pak prabowo utk mengusung sianies jd gubernur dki inna lillahi re chavesz,tanah yang disinggung sianies semalam rupanya pnh digadaikan pak prabowo untuk mengusung sianies jadi gubernur dki inna lillahi re chavesz,The land that Sianies mentioned last night was apparently mortgaged by Mr Prabowo to nominate Sianies to become governor of DKI inna lillahi re chavesz
TXT0276,ganjar mahfud hebat agunromli  bersih kuatkankpk sikatkorupsi hebata bukan nyogok tapi kkn korupsi kolusi nepotisme bersih kuatkankpk mahfud md,ganjar mahfud hebat agunromli bersih kuatkankpk sikatkorupsi hebata bukan nyogok tapi kkn korupsi kolusi nepotisme bersih kuatkankpk mahfud md,ganjar mahfud great agunromli clean strengthen kpk brush corruption great not bribery but corruption collusion nepotism clean strengthen kpk mahfud md
TXT0277,pak anies terkejut amp tidak mau banyak berkomentar soal presiden kok ikut memberikan komentar biarkan publik yg menilai dalam debat harus misa menjawab dan jangan berlindung dalam kerahasiaan ketika tidak bisa menjelaskan re bangpino,pak anies terkejut amp tidak mau banyak berkomentar soal presiden kok ikut memberikan komentar biarkan publik yang menilai dalam debat harus misa menjawab dan jangan berlindung dalam kerahasiaan ketika tidak bisa menjelaskan re bangpino,"Mr. Anies was surprised and didn't want to comment much on the president, but he also gave a comment. Let the public judge. In the debate, he must answer and not hide in secrecy when he can't explain. Re Bangpino"
TXT0278,bersama ganjar mahfud indonesia bersih dari korupsi re urrangawak,bersama ganjar mahfud indonesia bersih dari korupsi re urrangawak,with ganjar mahfud indonesia is clean from corruption re urrangawak
TXT0279,wuih kemandirian industri digital kita pasti makin meningkat nih dukungan ganjarmahfud ke umkm lokal melalui ecommerce bakal jadi dorongan besar buat pertumbuhan ekonomi digital kita happy new year,wuih kemandirian industri digital kita pasti makin meningkat nih dukungan ganjarmahfud ke umkm lokal melalui ecommerce bakal jadi dorongan besar buat pertumbuhan ekonomi digital kita happy new year,"Wow, the independence of our digital industry will definitely increase. Ganjarmahfud's support for local MSMEs through e-commerce will be a big boost for the growth of our digital economy. Happy New Year"
TXT0280,pendidikan adalah investasi jangka panjang dan ganjar memastikan prajurit memiliki dukungan penuh,pendidikan adalah investasi jangka panjang dan ganjar memastikan prajurit memiliki dukungan penuh,education is a long-term investment and rewards ensure soldiers have full support
TXT0281,buzzerr prabowogibran tidak punya rasa kemanusiaan mereka ramairamai membela oknum tni yang telah menghajar para relawan ganjarmahfud bahkan paling ironi mereka mendukung dan membenarkan tindakan oknum tni itu ya allah apakah mereka sudah tidak punya urat nadi kemanusiaan semua partai politik yang memiliki anggota legislatif kuat di daerah pasti akan melakukan kampanye dengan berbagai model parade ada yang pakai knalpot brong ada juga yang pakai mobil terbuka bawa alat musik semua dilakukan calegcaleg untuk menyambut uforia pesta demokrasi bersama basis masa di dapilnya entah itu pdip gerindragolkarpkbpkspan atau yang lainya hal yang sudah di anggap jamak lumrah karena bagian dari tradisi pemilihan caleg atau presiden tiap th an banyak juga yang ditangkap polisi satlantas motor mereka dibkandangin tidak bisa keluar karena mungkin pajaknya mati atau ternyata tidak ada suratnya nanti paling calegnya kasih uang ganti rugi karena kadernya kena tilang atau motornya ditahan nah kalo kejadian di boyolali itu kalian para pendukung prabowogibran membela tni sangat kejam dan moral kalian sudah minggat garagara hanya nomor rekening masuk tiap bulan apa ini memperlihatkan bahwa aparat tidak netral dan mereka berada dalam rangkaian ritual itu kemanusiaan kalian dimana jelas oknum tni di markas boyolali itu melakukan kekerasan bahkan kemarin waktu saya menjenguk salah satu korban bilang bahwa mereka semua bertuju diseret masuk ke markas dan dihajar secara bancaan sampai terluka berat ada satu korban belum sadar sampai sore kemarin apa itu tugas tni sedangkan jalan raya boyolali itu adalah jalan provinsi bukan jalab tni kepala satuan bisa saja tlp kasatlantas untuk menangkap mereka jika melanggar lalulintas karena hukum lalu lintas itu tidak di hajar sampai terluka parah seperti itu kamu dimana empatimu buzerr pak dan mas ini bukan masalah yang dihajar relawan ini soal kemanusian yang warga sipil sudah di hakimi oleh oknum tni yang secara keji bertindak semanamena tolong tementemen yang masih punya empati kawal terus kasus ini biar nanti tidak terulang lagi dan menimpa pihak manapun terimakasih re gusraharjo,buzzerr prabowogibran tidak punya rasa kemanusiaan mereka ramairamai membela oknum tni yang telah menghajar para relawan ganjarmahfud bahkan paling ironi mereka mendukung dan membenarkan tindakan oknum tni itu ya allah apakah mereka sudah tidak punya urat nadi kemanusiaan semua partai politik yang memiliki anggota legislatif kuat di daerah pasti akan melakukan kampanye dengan berbagai model parade ada yang pakai knalpot brong ada juga yang pakai mobil terbuka bawa alat musik semua dilakukan calegcaleg untuk menyambut uforia pesta demokrasi bersama basis masa di dapilnya entah itu pdip gerindragolkarpkbpkspan atau yang lainya hal yang sudah di anggap jamak lumrah karena bagian dari tradisi pemilihan caleg atau presiden tiap tahu an banyak juga yang ditangkap polisi satlantas motor mereka dibkandangin tidak bisa keluar karena mungkin pajaknya mati atau ternyata tidak ada suratnya nanti paling calegnya kasih uang ganti rugi karena kadernya kena tilang atau motornya ditahan nah kalo kejadian di boyolali itu kalian para pendukung prabowogibran membela tni sangat kejam dan moral kalian sudah minggat garagara hanya nomor rekening masuk tiap bulan apa ini memperlihatkan bahwa aparat tidak netral dan mereka berada dalam rangkaian ritual itu kemanusiaan kalian dimana jelas oknum tni di markas boyolali itu melakukan kekerasan bahkan kemarin waktu saya menjenguk salah satu korban bilang bahwa mereka semua bertuju diseret masuk ke markas dan dihajar secara bancaan sampai terluka berat ada satu korban belum sadar sampai sore kemarin apa itu tugas tni sedangkan jalan raya boyolali itu adalah jalan provinsi bukan jalab tni kepala satuan bisa saja telepon kasatlantas untuk menangkap mereka jika melanggar lalulintas karena hukum lalu lintas itu tidak di hajar sampai terluka parah seperti itu kamu dimana empatimu buzerr pak dan mas ini bukan masalah yang dihajar relawan ini soal kemanusian yang warga sipil sudah di hakimi oleh oknum tni yang secara keji bertindak semanamena tolong tementemen yang masih punya empati kawal terus kasus ini biar nanti tidak terulang lagi dan menimpa pihak manapun terimakasih re gusraharjo,"Prabowogibran's buzzer has no sense of humanity, they are all defending the TNI members who beat up Ganjarmahfud volunteers, even the most ironic thing is that they support and justify the actions of the TNI members, oh my God, do they no longer have a vein of humanity? All political parties that have strong legislative members in the regions will definitely campaign with various models of parades, some use brong exhausts, some use open cars carrying musical instruments, all of which are done by legislative candidates to welcome the euphoria of the democratic party with the mass base in their electoral districts, whether it's PDIP, Gerindra, Golkar, PKB, KSP, or others. This is something that is considered common because it is part of the tradition of electing legislative candidates or presidents every year. Many are also arrested by the police, their motorbikes are stopped and cannot be taken out because maybe their taxes have expired or it turns out that there are no documents. Later, at most, the legislative candidates will give compensation money because their cadres have been ticketed or their motorbikes have been confiscated. Well, if what happened in Boyolali happened, you Prabowogibran supporters who defend the TNI are very cruel and your morals have already left because only the account number comes in every month. This shows that the authorities are not neutral and they are in a series of rituals, your humanity where it is clear that the TNI officers at the Boyolali headquarters committed violence, even yesterday when I visited one of the victims, he said that they were all dragged into the headquarters and beaten until they were seriously injured, there was one victim who was not conscious until yesterday afternoon, what is the TNI's job while the Boyolali highway is a provincial road, not a TNI road, the head of the unit could have called the Head of Traffic to arrest them if they violated traffic because traffic laws are not beaten until they are seriously injured like that, where is your empathy, sir and sir, this is not a problem of being beaten by volunteers, this is a matter of humanity where civilians have been judged by TNI officers who acted cruelly, please friends who still have empathy, continue to monitor this case so that it will not happen again and befall any party, thank you, re gusraharjo"
TXT0282,dengan ganjarmahfud kotakota akan menjadi magnet ekonomi yang menarik investasi happy new year,dengan ganjarmahfud kotakota akan menjadi magnet ekonomi yang menarik investasi happy new year,with ganjarmahfud cities will become economic magnets that attract investment happy new year
TXT0283,sebut gaza dilindas karena tak punya kekuatan militer prabowo dianggap tanpa empati re oposisicerdas,sebut gaza dilindas karena tak punya kekuatan militer prabowo dianggap tanpa empati re oposisicerdas,say gaza was crushed because it has no military power prabowo is considered to have no empathy re opposition smart
TXT0284,pentingnya etika momen pendukung prabowo gibran teriak mengumpat di acara debat capres re muhiqr,pentingnya etika momen pendukung prabowo gibran teriak mengumpat di acara debat capres re muhiqr,the importance of ethics when Prabowo Gibran supporters shout curses at the presidential debate event re muhiqr
TXT0285,di debat ketiga capres prabowo subianto optimis utang luar industry,di debat ketiga capres prabowo subianto optimis utang luar industry,"In the third debate, presidential candidate Prabowo Subianto is optimistic about the external debt of the industry"
TXT0286,pasangan duet capres cawapres ganjar pranowo dan prof mahfud md lagi fokus bikin regulasi hukum yang gak bikin investor mikir dua kali untuk masuk indonesiajna,pasangan duet capres cawapres ganjar pranowo dan prof mahfud md lagi fokus bikin regulasi hukum yang enggak bikin investor mikir dua kali untuk masuk indonesiajna,"The presidential duet pair, Vice President, Ganjar Pranowo and Prof. Mahfud MD are currently focused on making legal regulations that don't make investors think twice about entering Indonesia."
TXT0287,ganjarmahfud bikin kebijakan pro kesejahteraan aph tas tes,ganjarmahfud bikin kebijakan pro kesejahteraan aph tas tes,Gangarmahfud makes a pro-welfare policy for APH test bags
TXT0288,suasana kebangsaan yang penuh semangat tercipta di sholawat kebangsaan ganjarmahfud di kota solo ketika ribuan masyarakat bersatu dalam menyanyikan lagu kebangsaan indonesia raya jawa tengah jateng,suasana kebangsaan yang penuh semangat tercipta di sholawat kebangsaan ganjarmahfud di kota solo ketika ribuan masyarakat bersatu dalam menyanyikan lagu kebangsaan indonesia raya jawa tengah jateng,"A spirited national atmosphere was created at the Ganjarmahfud national sholawat in the city of Solo when thousands of people united in singing the national anthem Indonesia Raya, Central Java, Central Java"
TXT0289,ganjar pranowo menjadikan pelayanan publik efisien dan transparan kita bangun bersama menuju pemerintahan yang lebih baik,ganjar pranowo menjadikan pelayanan publik efisien dan transparan kita bangun bersama menuju pemerintahan yang lebih baik,"Ganjar Pranowo makes public services efficient and transparent, we build together towards a better government"
TXT0290,berantas korupsi seminimal mungkin demi kemajuan dan kesejahteraan rakyat indonesia dukung dan menangkan ganjarmahfud di pilpres re tigadhewa,berantas korupsi seminimal mungkin demi kemajuan dan kesejahteraan rakyat indonesia dukung dan menangkan ganjarmahfud di pilpres re tigadhewa,"eradicate corruption as little as possible for the sake of the progress and welfare of the Indonesian people, support and win Ganjar Mahfud in the Re Tigadhewa presidential election"
TXT0291,cara prabowogibran hapus korupsi sejahterakan pejabat negara re tirtoid,cara prabowogibran hapus korupsi sejahterakan pejabat negara re tirtoid,Prabowo-Gibran's way of eradicating corruption and improving the welfare of state officials re tirtoid
TXT0292,capres no urut ganjar pranowo ajak ipb berani memimpin lewat kontrak terbuka untuk kedaulatan pangan,capres no urut ganjar pranowo ajak ipb berani memimpin lewat kontrak terbuka untuk kedaulatan pangan,presidential candidate number ganjar pranowo invites ipb to dare to lead through open contracts for food sovereignty
TXT0293,kejadian pak prabowo menyela ketika pak anies ngomong jadi sesuatu yg menunjukkan karakter yg sebenarnya debat ada tata aturan gagasan dan bantahan ga santai ah kasian anies jadi berkurang waktunya re zakkymusthofazu,kejadian pak prabowo menyela ketika pak anies mengomong jadi sesuatu yang menunjukkan karakter yang sebenarnya debat ada tata aturan gagasan dan bantahan enggak santai ah kasihan anies jadi berkurang waktunya re zakkymusthofazu,"The incident where Mr Prabowo interrupted Mr Anies while he was speaking is something that shows his true character. A debate has rules for ideas and objections, it's not relaxed. Oh, poor Anies, his time is reduced. Re zakkymusthofazu"
TXT0294,waduh mas mmgnya itu anggaran pandemi keluar dr harta pribadi pak ingat itu anggaran uang rakyat disaat rakyat susah ya sdh kewajiban ngr utk bantu ingat skali lagi bkn jasa dr menhan,waduh mas mmgnya itu anggaran pandemi keluar dari harta pribadi pak ingat itu anggaran uang rakyat disaat rakyat susah ya sudah kewajiban ngr untuk bantu ingat sekali lagi bukan jasa dari menhan,"Wow, sir, the pandemic budget actually came from personal assets, sir. Remember, it is the people's budget. When the people are in trouble, it is NGR's obligation to help. Remember, once again, it is not a service from the Minister of Defense."
TXT0295,caleg pada kampanye gw juga ahh inget yah tanggal februari itu kita ber demokrasi yang mau coblos anies dipersilahkan yang tidak pilih prabowo enggak apa yang enggak mendukung ganjar juga boleh semua asikasik aja wirrrrr re ffathurf,caleg pada kampanye gue juga ah ingat ya tanggal februari itu kita ber demokrasi yang mau coblos anies dipersilahkan yang tidak pilih prabowo enggak apa yang enggak mendukung ganjar juga boleh semua asikasik saja wirrrrr re ffathurf,"legislative candidates in my campaign too, remember, February is when we have a democracy, those who want to vote, those who don't vote for Prabowo are welcome, those who don't support gajar can also all just have fun wirrrrr re ffathurf"
TXT0296,hubungan internasional jadi makin solid dengan kebijakan pro kesejahteraan ganjarmahfud you rock,hubungan internasional jadi makin solid dengan kebijakan pro kesejahteraan ganjarmahfud you rock,international relations become more solid with pro-welfare policies ganjarmahfud you rock
TXT0297,prabowo jawab anies soal selatanselatan kalau hanya ngomong kumaha re oposisicerdas,prabowo jawab anies soal selatanselatan kalau hanya mengomong kumaha re oposisicerdas,Prabowo answers Anies about the South-South if he only talks about how to be an intelligent opposition
TXT0298,anies baswedan sebut pemerintah selama ini tak serius urusi pupuk re tempodotco,anies baswedan sebut pemerintah selama ini tak serius urusi pupuk re tempodotco,Anies Baswedan said the government has not been serious about managing Re Tempodotco fertilizer
TXT0299,ganjar pranowo mahfud md pemimpin yang merakyat dorong pertumbuhan ekonomi yang merata ganjar mahfud hebat guru ngaji satu juta,ganjar pranowo mahfud md pemimpin yang merakyat dorong pertumbuhan ekonomi yang merata ganjar mahfud hebat guru mengaji satu juta,"ganjar pranowo mahfud md a leader who is close to the people, encourages equitable economic growth ganjar mahfud is great, one million teachers study the Koran"
TXT0300,prabowo berulangkali menyalahkan bu sri mulyani atas kinerja buruk dirinya sebagai menhan siapa lagi yg salah pak pak basuki karena anggaran pupr menyedot anggaran kemhan atau bu retno marsudi karena diplomasi internasional beliau yg mantap mengambil spotlight dari anda re chicohakim,prabowo berulangkali menyalahkan bu sri mulyani atas kinerja buruk dirinya sebagai menhan siapa lagi yang salah pak pak basuki karena anggaran pupr menyedot anggaran kemhan atau bu retno marsudi karena diplomasi internasional beliau yang mantap mengambil spotlight dari anda re chicohakim,"Prabowo repeatedly blamed Mrs. Sri Mulyani for his poor performance as Minister of Defense. Who else is to blame? Mr. Basuki, because the PUPR budget has sucked up the Defense Ministry budget, or Mrs. Retno Marsudi, because her steady international diplomacy has taken the spotlight from you, Re Chico Hakim."
TXT0301,ganjarmahfud memenangkan dukungan rakyat dengan kebijakan yang bersifat konkret dan memberantas korupsi di kepolisian,ganjarmahfud memenangkan dukungan rakyat dengan kebijakan yang bersifat konkret dan memberantas korupsi di kepolisian,Ganjar Mahfud won the people's support with concrete policies and eradicating corruption in the police force.
TXT0302,visi ganjarmahfud akan menggerakkan pertumbuhan ekonomi yang merata di seluruh penjuru indonesia happy new year,visi ganjarmahfud akan menggerakkan pertumbuhan ekonomi yang merata di seluruh penjuru indonesia happy new year,Ganjarmahfud's vision will drive equitable economic growth throughout Indonesia. Happy New Year
TXT0303,mantan ketua umum pbnu periode said aqil siroj menyatakan dukungan terhadap capres dan cawapres paslon anies baswedancak imin amin re kumparan,mantan ketua umum pbnu periode said aqil siroj menyatakan dukungan terhadap capres dan cawapres paslon anies baswedancak imin amin re kumparan,former general chairman of pbnu for the period said aqil siroj expressed support for the presidential and vice presidential candidates anies baswedancak imin amin re kumparan
TXT0304,pak dan mas berkomitmen memberantas korupsi hingga ke akarakarnya melakukan perbaikan sistem dan bersungguhsungguh untuk menghapuskan korupsidiindonesia re prabowogibran,pak dan mas berkomitmen memberantas korupsi hingga ke akarakarnya melakukan perbaikan sistem dan bersungguhsungguh untuk menghapuskan korupsidiindonesia re prabowogibran,"Sir and Madam are committed to eradicating corruption to its roots, improving the system and are serious about eliminating corruption in Indonesia, Re Prabowogibran"
TXT0305,pengalaman tahun di legislatif dan tahun di eksekutif memperlihatkan pengalaman dan sudah terujinya capres no urut ganjar pranowo dalam menjalankan roda pemerintahan re simanjuntakelly,pengalaman tahun di legislatif dan tahun di eksekutif memperlihatkan pengalaman dan sudah terujinya capres no urut ganjar pranowo dalam menjalankan roda pemerintahan re simanjuntakelly,Years of experience in the legislature and years in the executive show the experience and proven track record of presidential candidate number Ganjar Pranowo in running the government of Re Simanjuntakelly
TXT0306,saya membacanya ketika pak bowok bilang omon omon omon adalah sebagai bentuk tekanan yang luar biasa karena kena ulti terus sama pak anies re bangpino,saya membacanya ketika pak bowok bilang omon omon omon adalah sebagai bentuk tekanan yang luar biasa karena kena ulti terus sama pak anies re bangpino,I read it when Mr. Bowok said that omon omon omon is a form of extraordinary pressure because he keeps getting ulti from Mr. Anies and Bangpino
TXT0307,capres no urut ganjar pranowo ajak ipb berani memimpin lewat kontrak terbuka untuk kedaulatan pangan,capres no urut ganjar pranowo ajak ipb berani memimpin lewat kontrak terbuka untuk kedaulatan pangan,presidential candidate number ganjar pranowo invites ipb to dare to lead through open contracts for food sovereignty
TXT0308,alfaridzys ganjar pranowo semoga daerah lain yang kekeringan mendapatkan perhatian yang sama terutama dari pemerintah terimakasih pak ganjar hebat happy new year,alfaridzys ganjar pranowo semoga daerah lain yang kekeringan mendapatkan perhatian yang sama terutama dari pemerintah terimakasih pak ganjar hebat happy new year,alfaridzys ganjar pranowo hopefully other areas experiencing drought will get the same attention especially from the government thank you Mr Ganjar great happy new year
TXT0309,program pasangan capres cawapres ganjar pranowo dan mahfud md solusi jitu buat dorong pertumbuhan ekonomi desa,program pasangan capres cawapres ganjar pranowo dan mahfud md solusi jitu buat dorong pertumbuhan ekonomi desa,presidential and vice presidential candidate pair Ganjar Pranowo and Mahfud MD's program is a smart solution to encourage village economic growth
